Linha Original,Linha Pré-processada,Sentimento
"Tomando um vinho, vivão e consciente","tom vinh , viv consci",Neutro
"Aí Batatão, Pablo, Neguin Emerson","aí batat , pabl , neguin emerson",Neutro
"Marquinho, Cascão, Johnny MC, Sora","marq , casc , johnny mc , sor",Neutro
"Marcão, Pantaleão, Nelito, Celião, Ivan, Di (na Zona Norte)","marc , pantal , nelit , cel , ivan , di ( zon nort )",Neutro
Sem palavra irmão,palavr irm,Neutro
Aí os irmão do Pantanal (na Zona Oeste),aí irm pantan ( zon oest ),Neutro
A rapa do morro e aos que estão com Deus,rap morr deu,Neutro
"(Na Zona Leste, cara tô na área)","( zon lest , car tô áre )",Neutro
"Deda, Tchai, Edi 16, Edi (na Zona Sul)","ded , tch , edi 16 , edi ( zon sul )",Neutro
Um dia nos encontraremos,dia encontr,Neutro
"A selva é como ela é, vaidosa e ambiciosa","selv , vaid ambici",Neutro
Irada e luxuriosa,ir luxuri,Negativo
Pros moleque da quebrada,pro molequ quebr,Negativo
"Um futuro mais ameno, essa é a meta","futur amen , met",Neutro
"Pela fundão, sem palavras, muito amor","fund , palavr , am",Neutro
"Ai, ai, ai, ai, ah","ai , ai , ai , ai , ah",Negativo
"Firmeza total, vagabundo","firm total , vagabund",Negativo
É desse jeito,dess jeit,Neutro
"Ra ra taratatá, tataratatatatá","ra ra taratat , tataratatatat",Neutro
Há,,Negativo
[Seu Jorge],[ jorg ],Neutro
"O enredo revela, que fica sem roteiro,","enred revel , fic rot ,",Negativo
"vou honrar o meu filme, ser forte","vou honr film , fort",Neutro
e mostrar quem eu sou pra você,mostr pra,Neutro
Dance Dance Dance,danc danc danc,Neutro
Dance Dance Dance,danc danc danc,Neutro
"luz e som, num desafio a chance","luz som , desafi chanc",Neutro
um entre mil romance,mil romanc,Neutro
além do limite onde o amor nos alcance então,além limit ond am alcanc ent,Neutro
Dance Dance Dance oooo,danc danc danc ooo,Neutro
Dance Dance Dance,danc danc danc,Neutro
livre na cena nos alto seguro,livr cen alt segur,Neutro
o groove não cai enfim te encontrei,groov cai enfim encontr,Negativo
nosso caso nas telas,cas tel,Neutro
dois vorás da lei,doi vor lei,Neutro
já travamos combates,trav combat,Negativo
com arte ainda vamos,art aind vam,Neutro
dançar outra vez,danç outr vez,Neutro
nessa história bandida,ness histór band,Negativo
qual meu pagamento final? eu não sei,pag final ? sei,Neutro
tão na vencida tão na da vida do amor,tão venc tão vid am,Neutro
longa metragem da dor,long metr dor,Negativo
Dance Dance Dance oooo,danc danc danc ooo,Neutro
Dance Dance Dance,danc danc danc,Neutro
"luz e som, num desafio a chance","luz som , desafi chanc",Neutro
um entre mil romance,mil romanc,Neutro
além do limite onde o amor nos alcance então,além limit ond am alcanc ent,Neutro
Dance Dance Dance,danc danc danc,Neutro
Dance Dance Dance,danc danc danc,Neutro
livre na cena nos alto seguro,livr cen alt segur,Neutro
o groove não cai enfim te encontrei,groov cai enfim encontr,Negativo
[Pixote],[ pixot ],Neutro
E se for possível em algum lugar vou-te ver dançar,possível algum lug vou-t ver danç,Neutro
se não vo te ligar e te encontrar,vo lig encontr,Negativo
amei seus detalhes eu gosto assim,ame detalh gost assim,Neutro
uma linda rosa que me convenceu no fim,lind ros convenc fim,Neutro
eu sei o que é isso o que eu vivo,sei viv,Neutro
o perigo é constante um aviso,perig const avis,Negativo
não sou aquele do carinho tenho o que dizer,car diz,Neutro
mas quero com você até amanhecer,quer amanhec,Neutro
viver esse momento e nada mais,viv moment nad,Neutro
é difícil não vou te difamar jamais,difícil vou difam jamal,Negativo
primeiro que quis você gosto quer BIS,prim quil gost qu bi,Neutro
eu sei do que fiz eu te fiz feliz,sei fiz fiz feliz,Neutro
Mademoiselle és capaz de me sorrir,mademoisell és capaz sorr,Neutro
vamos curtir um pouco mais,vam curt pouc,Neutro
fico gravado na mente,fic grav ment,Neutro
igual não acho a saudade é presente,igual ach saudad pres,Neutro
frente é puxar um bonde amigo,frent pux bond amig,Neutro
depois da dança comemora,danç comem,Neutro
que o vilão sumiu (hé hé),vil sum ( hé hé ),Negativo
ir ao romance esse louco que acendi até um lance,ir romanc louc acend lanc,Neutro
então Dance,ent danc,Neutro
Livre na cena nos alto seguro groove não cai,livr cen alt segur groov cai,Negativo
enfim te encontrei,enfim encontr,Neutro
[Mano Brown],[ man brown ],Neutro
Se o final for feliz,final feliz,Neutro
não os perdoaram sabe,perdo sab,Negativo
vamu fugi desse lugar Baby,vamu fug dess lug baby,Negativo
nas ilhas do sul fuga de alcatraz vem vê,ilh sul fug alcatraz vem vê,Negativo
nas Marginais como Bone e Clyde vê,marg bon clyd vê,Neutro
antes que acendam a luzes da ribalta,ant acend luz ribalt,Neutro
olhares se cruzem acusem minha falta,olh cruz acus falt,Negativo
no auge da festa na alta eu,aug fest alt,Neutro
"mó guela mó, mó vela","mó guel mó , mó vel",Neutro
longe sem brisa naquela,long bris naquel,Negativo
sem mais mil uma noite seqüela eu,mil noit seqüel,Negativo
também fui vexame meu tsunami é seu,vexam tsunam,Negativo
esse meu mundo infame,mund infam,Negativo
a chapelandia não vê,chapeland vê,Negativo
não entende a discórdia,entend discórd,Negativo
eu quero é liberdade não misericórdia,quer liberdad misericórd,Neutro
agora se quiser vem se não quer vem (eu Vou),agor quis vem qu vem ( vou ),Neutro
assalto do trem pagador,assalt tr pag,Negativo
dos malotes de amor,malot am,Neutro
e felicidade dádiva que meu Deus deixou vamô,felic dádiv deu deix vamô,Neutro
antes que venha o ataque,ant venh ataqu,Negativo
e nos queime na praça igual a Joana Dark,queim praç igual joan dark,Negativo
um dia entre nós esse som e a saudade,dia som saudad,Neutro
era uma vez,vez,Neutro
de um tempo em que éramos reis,temp reil,Neutro
de quando o campinho era um palco zica,camp palc zic,Neutro
e o crime era um passo do Michael,crim pass michael,Negativo
aos trancos barracos e barrancos debate,tranc barrac barranc debat,Negativo
louco as 2 horas esperando o resgate,louc 2 hor esper resgat,Negativo
mar proibido e um mal compreendido,mar proib mal compreend,Negativo
e um amor bandido em um outro nível,am band outr nível,Negativo
se for possível,possível,Neutro
Dance Dance Dance oooo,danc danc danc ooo,Neutro
Dance Dance Dance,danc danc danc,Neutro
"É tru, Racionais tá aí de novo, morô?","tru , racion tá aí nov , morô ?",Neutro
E os caras é mili anos na parada (pode crê),car mil ano par ( pod crê ),Neutro
E o caras representa a favela do começo ao fim,car represent favel começ fim,Neutro
"Mais aí, é muita treta em","aí , muit tret",Negativo
é idéia de mil grau no baguio,idé mil grau bagui,Neutro
Racionais roubando a cena,racion roub cen,Neutro
Realidade é a palavra,real palavr,Neutro
atitude é o meu o lema,atitud lem,Neutro
Esquema feito a justiça está com nóis,esquem feit justiç nóil,Negativo
"Lei da periferia irmão, ouça a minha voz","lei perif irm , ouç voz",Neutro
Meu rap é linha de frente dessa guerrilha,rap linh frent dess guerrilh,Neutro
"Faça o que puder, vier siga minha estreita trilha","faç pud , vi sig estreit trilh",Neutro
Na picadilha a matilha está a solta,picadilh matilh solt,Neutro
Idéia de mil grau e o veneno escorrendo da boca,idé mil grau venen escorr boc,Negativo
[Mano Brown],[ man brown ],Neutro
"Nego, a vida é loka","neg , vid lok",Neutro
Cruel e sangrenta,cruel sangrent,Negativo
"Só muito pior, sem dó, marginal e violenta","pi , dó , marg violent",Negativo
"O sangue esquenta, ei Éder eu quero ver","sang esquent , ei éd quer ver",Negativo
[Mano Brown],[ man brown ],Neutro
Edinho liga o Marquinhos pra fazer o chão tremer,edinh lig marq pra faz chã trem,Negativo
Pode crê,pod crê,Neutro
Não sou aquele que via satélite te seduz,via satélit seduz,Neutro
Porque bala de PT não faz sinal da cruz,porqu bal pt faz sinal cruz,Negativo
Nem muito menos tô aqui pra fazer média,menos tô aqu pra faz méd,Neutro
Não sou aquele que pega carona na tragédia,peg caron tragéd,Negativo
Vejo de perto a viúva da dor,vej pert viúv dor,Negativo
"Pisando em caco de vidro, filha do rancor","pis cac vidr , filh ranc",Negativo
Convivendo com o divino e o diabólico,conviv divin diaból,Neutro
"Entre os crentes, espíritas, o crime e os católicos","crent , espírit , crim catól",Neutro
"Tristes, eufóricos, tranquilos e melancólicos","trist , eufór , tranquil melancól",Negativo
O engatilhado sofrimento é metabólico,engatilh sofr metaból,Negativo
"Soldado da paz, mas treinado para guerra","sold paz , trein guerr",Neutro
Meu arsenal é o seu calvário nas ruas da serra,arsen calv rua serr,Negativo
"São Paulo, dia 1º de Outubro de 1992, oito horas da manhã","paul , dia 1º outubr 1992 , oit hor manhã",Neutro
"Aqui estou, mais um dia","aqu , dia",Neutro
Sob o olhar sanguinário do vigia,sob olh sanguin vig,Negativo
Você não sabe como é caminhar com a cabeça na mira de uma HK,sab caminh cabeç mir hk,Neutro
Metralhadora alemã ou de Israel,metralh alemã israel,Neutro
Estraçalha ladrão que nem papel,estraçalh ladr papel,Negativo
"Na muralha, em pé, mais um cidadão José","muralh , pé , cidad josé",Neutro
"Servindo o Estado, um PM bom","serv est , pm bom",Neutro
"Passa fome, metido a Charles Bronson","pass fom , met charl bronson",Negativo
Ele sabe o que eu desejo,sab desej,Neutro
Sabe o que eu penso,sab pens,Neutro
"O dia tá chuvoso, o clima tá tenso","dia tá chuv , clim tá tens",Negativo
"Vários tentaram fugir, eu também quero","vári tent fug , quer",Negativo
"Mas de um a cem, a minha chance é zero","cem , chanc zer",Negativo
Será que Deus ouviu minha oração?,deu ouv oraç ?,Neutro
Será que o juiz aceitou a apelação?,juiz aceit apel ?,Negativo
Mando um recado lá pro meu irmão,mand rec lá pro irm,Neutro
"Se tiver usando droga, tá ruim na minha mão","us drog , tá ruim mão",Negativo
Ele ainda tá com aquela mina,aind tá min,Neutro
"Pode crer, moleque é gente fina","pod cr , molequ gent fin",Neutro
"Tirei um dia a menos ou um dia a mais, sei lá","tir dia menos dia , sei lá",Neutro
"Tanto faz, os dias são iguais","tant faz , dia igual",Neutro
"Acendo um cigarro, e vejo o dia passar","acend cigarr , vej dia pass",Negativo
Mato o tempo pra ele não me matar,mat temp pra mat,Negativo
"Homem é homem, mulher é mulher","hom hom , mulh mulh",Neutro
"Estuprador é diferente, né?","estupr difer , né ?",Neutro
"Toma soco toda hora, ajoelha e beija os pés","tom soc tod hor , ajoelh beij pé",Negativo
E sangra até morrer na rua 10,sangr morr rua 10,Negativo
"Cada detento uma mãe, uma crença","cad detent mãe , crenç",Neutro
Cada crime uma sentença,cad crim sentenç,Negativo
"Cada sentença um motivo, uma história de lágrima","cad sentenç motiv , histór lágr",Neutro
"Sangue, vidas inglórias, abandono, miséria, ódio","sang , vid inglór , abandon , misér , ódi",Negativo
"Sofrimento, desprezo, desilusão, ação do tempo","sofr , desprez , desilus , açã temp",Negativo
Misture bem essa química,mistur bem quím,Neutro
"Pronto, eis um novo detento","pront , ei nov detent",Neutro
"Lamentos no corredor, na cela, no pátio","lament corr , cel , páti",Negativo
"Ao redor do campo, em todos os cantos","redor camp , tod cant",Neutro
"Mas eu conheço o sistema, meu irmão, hã","conheç sistem , irm , hã",Neutro
Aqui não tem santo,aqu sant,Neutro
Rátátátá preciso evitar,rátátát precis evit,Negativo
Que um safado faça minha mãe chorar,saf faç mãe chor,Negativo
Minha palavra de honra me protege,palavr honr proteg,Neutro
Pra viver no país das calças bege,pra viv país calç beg,Neutro
"Tic, tac, ainda é 9 e 40","tic , tac , aind 9 40",Neutro
O relógio da cadeia anda em câmera lenta,relógi cade and câm lent,Negativo
"Ratatatá, mais um metrô vai passar","ratatat , metrô vai pass",Neutro
"Com gente de bem, apressada, católica","gent bem , apress , catól",Neutro
"Lendo jornal, satisfeita, hipócrita","lend jorn , satisfeit , hipócrit",Negativo
"Com raiva por dentro, a caminho do centro","raiv dentr , caminh centr",Negativo
"Olhando pra cá, curiosos, é lógico","olh pra cá , curi , lógic",Neutro
"Não, não é não, não é o zoológico",", , zoológ",Neutro
Minha vida não tem tanto valor,vid tant val,Neutro
"Quanto seu celular, seu computador","quant celul , comput",Neutro
"Hoje tá difícil, não saiu o Sol","hoj tá difícil , saiu sol",Negativo
"Hoje não tem visita, não tem futebol","hoj visit , futebol",Negativo
Alguns companheiros têm a mente mais fraca,algum companh têm ment frac,Negativo
"Não suportam o tédio, arruma quiaca","suport tédi , arrum quiac",Negativo
Graças a Deus e à Virgem Maria,graç deu virgem mar,Neutro
"Faltam só um ano, três meses e uns dias","falt ano , trê mes um dia",Negativo
Tem uma cela lá em cima fechada,cel lá cim fech,Negativo
Desde Terça-feira ninguém abre pra nada,desd terça-f ninguém abr pra nad,Neutro
Só o cheiro de morte e Pinho Sol,cheir mort pinh sol,Negativo
Um preso se enforcou com o lençol,pres enforc lençol,Negativo
Qual que foi? Quem sabe? Não conta,? sab ? cont,Negativo
Ia tirar mais uns seis de ponta a ponta,ia tir um seil pont pont,Neutro
Nada deixa um homem mais doente,nad deix hom doent,Negativo
Que o abandono dos parentes,abandon parent,Negativo
"Aí moleque, me diz, então, cê quer o quê?","aí molequ , diz , ent , cê qu quê ?",Neutro
A vaga tá lá esperando você,vag tá lá esper,Neutro
Pega todos seus artigos importado,peg tod artig import,Neutro
Seu currículo no crime e limpa o rabo,currícul crim limp rab,Neutro
A vida bandida é sem futuro,vid band futur,Negativo
Sua cara fica branca desse lado do muro,car fic branc dess lad mur,Neutro
Já ouviu falar de Lúcifer?,ouv fal lúcif ?,Negativo
Que veio do Inferno com moral,vei infern moral,Negativo
"Um dia no Carandiru, não, ele é só mais um","dia carandiru , ,",Neutro
Comendo rango azedo com pneumonia,com rang azed pneumon,Negativo
"Aqui tem mano de Osasco, do Jardim D'Abril, Parelheiros","aqu man osasc , jardim d'abril , parelh",Neutro
"Mogi, Jardim Brasil, Bela Vista, Jardim Ângela","mog , jardim brasil , bel vist , jardim ângel",Neutro
"Heliópolis, Itapevi, Paraisópolis","heliópolil , itapev , paraisópolil",Neutro
Ladrão sangue bom tem moral na quebrada,ladr sang bom moral quebr,Negativo
"Mas pro Estado é só um número, mais nada","pro est númer , nad",Neutro
"Nove pavilhões, sete mil homens","nov pavilh , set mil hom",Neutro
"Que custam trezentos reais por mês, cada","cust trezent real mê , cad",Neutro
"Na última visita, o neguinho veio aí","últ visit , negu vei aí",Neutro
"Trouxe umas frutas, Marlboro, Free","troux uma frut , marlbor , fre",Neutro
Ligou que um pilantra lá da área voltou,lig pilantr lá áre volt,Negativo
"Com Kadett vermelho, placa de Salvador","kadett vermelh , plac salv",Negativo
"Pagando de gatão, ele xinga, ele abusa","pag gat , xing , abus",Negativo
Com uma nove milímetros embaixo da blusa,nov milímetr embaix blus,Negativo
"Aí neguinho, vem cá, e os manos onde é que tá?","aí negu , vem cá , man ond tá ?",Negativo
Lembra desse cururu que tentou me matar?,lembr dess cururu tent mat ?,Negativo
"Aquele puta ganso, pilantra corno manso","put gans , pilantr corn mans",Negativo
Ficava muito doido e deixava a mina só,fic doid deix min,Negativo
A mina era virgem e ainda era menor,min virgem aind men,Negativo
Agora faz chupeta em troca de pó,agor faz chupet troc pó,Neutro
Esses papos me incomoda,pap incomod,Negativo
Se eu tô na rua é foda,tô rua fod,Negativo
"É, o mundo roda, ele pode vir pra cá",", mund rod , pod vir pra cá",Neutro
"Não, já, já, meu processo tá aí",", , , process tá aí",Neutro
"Eu quero mudar, eu quero sair","quer mud , quer sair",Neutro
"Se eu trombo esse fulano, não tem pá, não tem pum","tromb fulan , pá , pum",Negativo
E eu vou ter que assinar o 121,vou ter assin 121,Neutro
"Amanheceu com Sol, dois de Outubro","amanhec sol , doi outubr",Neutro
"Tudo funcionando, limpeza, jumbo","tud funcion , limp , jumb",Neutro
De madrugada eu senti um calafrio,madrug sent calafri,Negativo
"Não era do vento, não era do frio","vent , fri",Neutro
Acertos de conta tem quase todo dia,acert cont quas tod dia,Neutro
"Tem outra logo mais, hãn, eu sabia","outr log , hãn , sab",Neutro
Lealdade é o que todo preso tenta,lealdad tod pres tent,Neutro
"Conseguir a paz, de forma violenta","consegu paz , form violent",Negativo
Se um salafrário sacanear alguém,salafr sacan alguém,Negativo
Leva ponto na cara igual Frankestein,lev pont car igual frankestein,Neutro
"Fumaça na janela, tem fogo na cela","fumaç janel , fog cel",Negativo
"Fudeu, foi além, se pã, tem refém","fud , além , pã , refém",Negativo
"Na maioria, se deixou envolver","maior , deix envolv",Neutro
Por uns cinco ou seis que não têm nada a perder,um cinc seil têm nad perd,Neutro
Dois ladrões considerados passaram a discutir,doi ladr consider pass discut,Negativo
Mas não imaginavam o que estaria por vir,imagin est vir,Neutro
"Traficantes, homicidas, estelionatários","trafic , homic , estelionat",Negativo
Uma maioria de moleque primário,maior molequ prim,Neutro
Era a brecha que o sistema queria,brech sistem quer,Neutro
"Avise o IML, chegou o grande dia","avis iml , cheg grand dia",Neutro
Depende do sim ou não de um só homem,depend sim hom,Neutro
Que prefere ser neutro pelo telefone,pref neutr telefon,Neutro
"Ratatatá, caviar e champanhe","ratatat , cavi champanh",Neutro
"Fleury foi almoçar, que se foda a minha mãe","fleury almoç , fod mãe",Neutro
"Cachorros assassinos, gás lacrimogêneo","cachorr assassin , gás lacrimogêne",Negativo
Quem mata mais ladrão ganha medalha de prêmio,mat ladr ganh medalh prêmi,Negativo
O ser humano é descartável no Brasil,human descart brasil,Negativo
Como modess usado ou Bombril,modes us bombril,Neutro
Cadeia? Guarda o que o sistema não quis,cade ? guard sistem quil,Neutro
Esconde o que a novela não diz,escond novel diz,Neutro
Ratatatá sangue jorra como água,ratatat sang jorr águ,Negativo
"Do ouvido, da boca e nariz","ouv , boc nariz",Neutro
O Senhor é meu pastor,senh pastor,Neutro
Perdoe o que seu filho fez,perdo filh fez,Negativo
Morreu de bruços no Salmo 23,morr bruç salm 23,Negativo
"Sem padre, sem repórter","padr , repórt",Negativo
"Sem arma, sem socorro","arm , socorr",Negativo
Vai pegar HIV na boca do cachorro,vai peg hiv boc cachorr,Negativo
"Cadáveres no poço, no pátio interno","cadáv poç , páti intern",Negativo
Adolf Hitler sorri no inferno,adolf hitl sorr infern,Negativo
"O Robocop do governo é frio, não sente pena","robocop govern fri , sent pen",Neutro
Só ódio e ri como a hiena,ódi ri hien,Negativo
"Ratatatá, Fleury e sua gangue","ratatat , fleury gangu",Negativo
Vão nadar numa piscina de sangue,vão nad piscin sang,Negativo
Mas quem vai acreditar no meu depoimento?,vai acredit depo ?,Neutro
"Dia 3 de Outubro, diário de um detento","dia 3 outubr , diári detent",Neutro
"São apenas dez e meia, tem a noite inteira","apen dez mei , noit int",Neutro
"Dormir é embaçado, numa sexta-feira","dorm embaç , sexta-f",Negativo
"TV é uma merda, prefiro ver a lua","tv merd , prefir ver lua",Negativo
Preto Edy Rock Star a caminho da rua,pret edy rock st caminh rua,Neutro
"Hã... sei lá vou pruma festa, ""se pam""","hã ... sei lá vou prum fest , `` pam ''",Neutro
"Se os cara não colar, volto às três da manhã","car col , volt trê manhã",Neutro
"Tô devagar, tô a cinquenta por hora","tô devag , tô cinquent hor",Negativo
"Ouvindo funk do bom, minha trilha sonora","ouv funk bom , trilh son",Neutro
"A polícia cresce o olho, eu quero que se foda!","políci cresc olh , quer fod !",Negativo
Zona Norte a bandidagem curte a noite toda,zon nort bandid curt noit tod,Neutro
Eu me formei suspeito profissional,form suspeit profiss,Neutro
"Bacharel pós-graduado em ""tomar geral""",bacharel pós-gradu `` tom geral '',Neutro
"Eu tenho um manual com os lugares, horários, de como ""dar perdido""","man lug , hor , `` dar perd ''",Neutro
"Aí, caralho... ( ""prefixo da placa é MY, sentido Jaçanã, Jardim Hebron..."")","aí , caralh ... ( `` prefix plac my , sent jaçanã , jardim hebron ... '' )",Neutro
Quem é preto como eu já tá ligado qual é,pret tá lig,Neutro
"Nota Fiscal, RG, polícia no pé","not fiscal , rg , políci pé",Neutro
"(""Escuta aqui: o primo do cunhado do meu genro é mestiço",( `` escut aqu : prim cunh genr mestiç,Neutro
"Racismo não existe, comigo não tem disso. É pra sua segurança"")","rac exist , comig diss . pra seguranç '' )",Neutro
"Falou, falou, deixa pra lá","fal , fal , deix pra lá",Neutro
Vou escolher em qual mentira vou acreditar,vou escolh ment vou acredit,Neutro
"Tem que saber curtir, tem que saber lidar","sab curt , sab lid",Neutro
Em qual mentira vou acreditar?,ment vou acredit ?,Negativo
"A noite é assim mesmo, então... deixa rolar","noit assim , ent ... deix rol",Neutro
Em qual mentira vou acreditar?,ment vou acredit ?,Negativo
"Tem que saber curtir, tem que saber lidar","sab curt , sab lid",Neutro
Em qual mentira vou acreditar?,ment vou acredit ?,Negativo
"Ô, que caras chato, ó! Quinze pras Onze","ô , car chat , ó ! quinz pra onz",Negativo
"Eu nem fui muito longe e os ""home"" embaçou",long `` hom '' embaç,Negativo
"Revirou os banco, amassou meu boné branco","revir banc , amass boné branc",Negativo
Sujou minha camisa dos Santos,suj camis sant,Negativo
Eu nem me lembro mais pra onde eu vou,lembr pra ond vou,Neutro
"E agora, quem será que ligou?","agor , lig ?",Negativo
"""Me espere na estação, eu tô na Zona Sul","`` esper estaçã , tô zon sul",Neutro
"Eu chego rapidinho, assinado: Blue""","cheg rapid , assin : blu ''",Neutro
"Pode crer, naquele lado de Santana","pod cr , naquel lad sant",Neutro
"Conheço uns lugar, conheço umas fulana","conheç um lug , conheç uma fulan",Neutro
Juliana? Não. Mariana? Não. Alessandra? Não. Adriana?,juli ? . mari ? . alessandr ? . adri ?,Neutro
"O nome é só um detalhe, o nome é só um nome","nom detalh , nom nom",Neutro
"9532... hum, esqueci o telefone","9532 ... hum , esquec telefon",Negativo
"""Porra, demorou, heim?!"" E aí, Blue, como é?","`` porr , demor , heim ? ! '' aí , blu , ?",Negativo
"Isso aqui é um inferno, tem uma par de mulher","aqu infern , par mulh",Negativo
"Trombei uma par de gente, uma par de mano","tromb par gent , par man",Neutro
Tô há quase uma hora te esperando,tô quas hor esper,Neutro
Passou uma figura aqui e deu ideia,pass figur aqu deu ide,Neutro
"Disse que te conhece e pá, chama Léa","diss conhec pá , cham léa",Neutro
"Cabelo solto, vestido vermelho","cabel solt , vest vermelh",Neutro
Estrategicamente a um palmo do joelho,estrategic palm joelh,Neutro
"Os caras comentaram o visual, oh os bico e tal, pagando o maior pau.","car coment visual , oh bic tal , pag mai pau .",Neutro
"Ninguém falou, ah! ah! mas eu ouvia meio mundo","ninguém fal , ah ! ah ! ouv mei mund",Negativo
"Xingando por telepatia (""mina filha da puta!"").",xing telepat ( `` min filh put ! `` ) .,Negativo
"Economizava meu vocabulário, não tinha o que falar","economiz vocabul , fal",Neutro
"Falava o necessário, meio assim, é claro","fal necess , mei assim , clar",Neutro
"Será qual é que é, truta é o que não falta, mina filha da puta",", trut falt , min filh put",Neutro
"Tudo comigo, confio no meu taco, versão africana ""Don Juan de Marco""","tud comig , confi tac , vers afric `` don juan marc ''",Neutro
"Tudo muito bom, tudo muito bem, sei lá o que é que tem","tud bom , tud bem , sei lá",Neutro
"Idéia vai, idéia vem, ela era princesa, eu era o plebeu","idé vai , idé vem , princes , pleb",Neutro
"Quem é mais foda que eu, espelho, espelho meu","fod , espelh , espelh",Neutro
"""Tipo Taís de Araújo ou Camila Pitanga?""",`` tip taí araúj camil pitang ? '',Neutro
Uma mistura. Confesso: fiquei de perna bamba,mist . confess : fiq pern bamb,Neutro
Será que ela aceita ir comigo pro baile?,aceit ir comig pro bail ?,Neutro
"Ou ir pra Zona Sul ter um ""Grand Finale""?",ir pra zon sul ter `` grand final '' ?,Neutro
Amor com gosto de gueto até às seis da manhã,am gost guet seil manhã,Neutro
"Me chamar de ""meu preto"" e me cantar ""Djavan""",cham `` pret '' cant `` djavan '',Neutro
"Ninguém ouviu, mas... puta que pariu!","ninguém ouv , ... put par !",Negativo
Em fração de segundos meu castelo caiu!,fraç segund castel caiu !,Negativo
"A mais bonita da escola, rainha passista","bonit escol , rainh pass",Neutro
Se transformou numa vaca nazista!,transform vac nazist !,Negativo
"Eu ouvindo James Brown, pá, cheio de pose","ouv jam brown , pá , chei pos",Neutro
Ela pergunto se eu tenho... o quê?,pergunt ... quê ?,Neutro
Guns n' Roses? Lógico que não! A mina quase histérica,gum n ' ros ? lógic ! min quas histér,Negativo
Meteu a mão no rádio e pôs na Transamérica,met mão rádi pô transamér,Neutro
Como é que ela falou? Só se liga nessa,fal ? lig ness,Neutro
"Que mina cabulosa, olha só que conversa:","min cabul , olh convers :",Neutro
Que tinha bronca de neguinho de salão (não...),bronc negu sal ( ... ),Negativo
Que a maioria é maloqueiro e ladrão (aí não...),maior maloc ladr ( aí ... ),Negativo
"Aí não, mano! Foi por pouco","aí , man ! pouc",Negativo
Eu já tava pensando em capotar no soco,tav pens capot soc,Negativo
Disse pra mim não falar gíria com ela,diss pra mim fal gír,Neutro
pra me lembrar que não tô na favela,pra lembr tô favel,Neutro
