Linha Original,Linha Pré-processada,Sentimento
Por que Deus chora,deu chor,Negativo
"Muita pobreza, estoura violência!","muit pobr , esto viol !",Negativo
Nossa raça está morrendo,raç morr,Negativo
Não me diga que está tudo bem!,dig tud bem !,Neutro
"Muita pobreza, estoura violência!","muit pobr , esto viol !",Negativo
Nossa raça está morrendo,raç morr,Negativo
Não me diga que está tudo bem!,dig tud bem !,Neutro
"Muita pobreza, estoura violência!","muit pobr , esto viol !",Negativo
Nossa raça está morrendo,raç morr,Negativo
Não me diga que está tudo bem!,dig tud bem !,Neutro
"Muita pobreza, estoura violência!","muit pobr , esto viol !",Negativo
Nossa raça está morrendo,raç morr,Negativo
Verdade seja dita!,verdad dit !,Negativo
"Vi só a alguns anos pra cá, pode acreditar","vi algum ano pra cá , pod acredit",Neutro
Já foi bastante pra me preocupar,bast pra preocup,Negativo
"Com meus filhos, periferia é tudo igual","filh , perif tud igual",Neutro
Todo mundo sente medo de sair de madrugada e tal,tod mund sent med sair madrug tal,Negativo
"Ultimamente, andam os doidos pela rua","ultim , and doid rua",Negativo
"Loucos na fissura, te estranham na loucura","louc fiss , estranh louc",Negativo
"Pedir dinheiro é mais fácil que roubar, mano","ped dinh fácil roub , man",Negativo
"Roubar é mais fácil que trampar, mano","roub fácil tramp , man",Neutro
É complicado,complic,Negativo
O vício tem dois lados,víci doi lad,Negativo
"Depende disso ou daquilo, ou não, tá tudo errado","depend diss daquil , , tá tud err",Negativo
"Eu não vou ficar do lado de ninguém, por quê?","vou fic lad ninguém , quê ?",Neutro
Quem vende a droga pra quem? Hã!,vend drog pra ? hã !,Negativo
"Vem pra cá de avião ou pelo porto, cais","vem pra cá avi port , cais",Neutro
Não conheço pobre dono de aeroporto e mais,conheç pobr don aeroport,Neutro
Fico triste por saber e ver,fic trist sab ver,Negativo
Que quem morre no dia a dia é igual a eu e a você,morr dia dia igual,Negativo
Periferia é periferia,perif perif,Negativo
(Que horas são? Não sei responder),( hor ? sei respond ),Neutro
Periferia é periferia,perif perif,Negativo
(Milhares de casas amontoadas),( milh cas amonto ),Negativo
Periferia é periferia,perif perif,Negativo
"(Vacilou, ficou pequeno. Pode acreditar)","( vacil , fic pequen . pod acredit )",Negativo
Periferia é periferia (em qualquer lugar),perif perif ( qualqu lug ),Neutro
(Gente pobre),( gent pobr ),Negativo
Periferia é periferia,perif perif,Negativo
"(Vários botecos abertos, várias escolas vazias)","( vári botec abert , vár escol vaz )",Negativo
Periferia é periferia,perif perif,Negativo
(E a maioria por aqui se parece comigo),( maior aqu parec comig ),Neutro
Periferia é periferia,perif perif,Negativo
"(Mães chorando, irmãos se matando. Até quando?)","( mão chor , irm mat . ? )",Negativo
Periferia é periferia,perif perif,Negativo
(Em qualquer lugar. Gente pobre),( qualqu lug . gent pobr ),Neutro
Periferia é periferia,perif perif,Negativo
"(Aqui, meu irmão, é cada um por si)","( aqu , irm , cad si )",Neutro
Periferia é periferia,perif perif,Negativo
(Molecada sem futuro eu já consigo ver),( molec futur consig ver ),Negativo
Periferia é periferia,perif perif,Negativo
"(Aliados, drogados, então)","( ali , drog , ent )",Neutro
Periferia é periferia (em qualquer lugar),perif perif ( qualqu lug ),Neutro
(Gente pobre),( gent pobr ),Negativo
Periferia é periferia,perif perif,Negativo
"(Deixe o crack de lado, escute o meu recado)","( deix crack lad , escut rec )",Neutro
"Preto zica, truta meu, disse assim:","pret zic , trut , diss assim :",Neutro
"""Ih truta, mó fita!""","`` ih trut , mó fit ! ''",Negativo
O truta meu disse assim (vai vendo),trut diss assim ( vai vend ),Neutro
"Preto zica, truta meu, disse assim:","pret zic , trut , diss assim :",Neutro
"""Mó fita, mó treta!""","`` mó fit , mó tret ! ''",Negativo
O truta meu disse assim (que fita),trut diss assim ( fit ),Neutro
"Preto zica, truta meu, disse assim:","pret zic , trut , diss assim :",Neutro
"""Ih truta, mó fita!""","`` ih trut , mó fit ! ''",Negativo
O truta meu disse assim (vai vendo),trut diss assim ( vai vend ),Neutro
"Preto zica, truta meu, disse assim:","pret zic , trut , diss assim :",Neutro
"""Mó fita, mó treta!""","`` mó fit , mó tret ! ''",Negativo
O truta meu disse assim (que fita),trut diss assim ( fit ),Neutro
"Veja quanta ideia, bonitão","vej quant ide , bonit",Neutro
"Os truta aqui tão, no mó conchavo","trut aqu tão , mó conchav",Neutro
Torcendo por você e calculando seu cada centavo,torc calcul cad centav,Neutro
Ficaram cego e a meta é tomar seu lugar,fic ceg met tom lug,Negativo
"Intravenosa, venenosa, via jugular","intraven , venen , via jugul",Negativo
Eu não quero tá na pele dos que leva e traz,quer tá pel lev traz,Neutro
Nem imaginar ou sumariar esse rapaz,imagin sumari rapaz,Negativo
"Salve, mas um truta meu assim me disse:","salv , trut assim diss :",Neutro
"""Negar dinheiro é o caralho, não fala tolices""","`` neg dinh caralh , fal tolic ''",Neutro
"Que nem boliche, vixe, apavorou","bolich , vix , apavor",Negativo
Mas o resultado é consequência que o mestre falou,result consequ mestr fal,Neutro
"É tudo um teste, how! É como peste:","tud test , how ! pest :",Negativo
Alastra e arrasta até que nada do nada me reste,alastr arrast nad nad rest,Negativo
Um truta meu me disse que o chicote estrala,trut diss chicot estral,Negativo
O inimigo da risada da sua vala no sofá da sala,inimig ris val sof sal,Negativo
"Como se fala: ""uma bala, escolha a sua!""","fal : `` bal , escolh ! ''",Neutro
Encomenda o fracasso do palhaço em plena luz da lua,encomend fracass palh plen luz lua,Negativo
Quem de alma nua atua na sua mente,alm nua atu ment,Neutro
Faz você achar que o azar é só mero presente,faz ach azar mer pres,Negativo
Que aquela treta do passado se torne recente,tret pass torn recent,Negativo
"Remanescente, dificilmente sai da guerra cientes","remanesc , dificil sai guerr cient",Neutro
"É deprimente, inocente, não olha pra frente","depr , inoc , olh pra frent",Negativo
Em cada mente um pensamento desse inconsequente,cad ment pens dess inconsequ,Negativo
"Ou indecente, tente, ou iminente, é quente","indec , tent , imin , quent",Negativo
É simplesmente: São vários e vários doentes,simples : vári vári doent,Negativo
"Preto zica, truta meu, disse assim:","pret zic , trut , diss assim :",Neutro
"""Ih truta, mó fita!""","`` ih trut , mó fit ! ''",Negativo
O truta meu disse assim (vai vendo),trut diss assim ( vai vend ),Neutro
"Preto zica, truta meu, disse assim:","pret zic , trut , diss assim :",Neutro
"""Mó fita, mó treta!""","`` mó fit , mó tret ! ''",Negativo
O truta meu disse assim (que fita),trut diss assim ( fit ),Neutro
"Preto zica, truta meu, disse assim:","pret zic , trut , diss assim :",Neutro
"""Ih truta, mó fita!""","`` ih trut , mó fit ! ''",Negativo
O truta meu disse assim (vai vendo),trut diss assim ( vai vend ),Neutro
"Preto zica, truta meu, disse assim:","pret zic , trut , diss assim :",Neutro
"""Mó fita, mó treta!""","`` mó fit , mó tret ! ''",Negativo
O truta meu disse assim,trut diss assim,Neutro
"""Primeira coisa que aprendi a fazer",`` prim cois aprend faz,Neutro
"Na minha vida foi isso aqui, ó","vid aqu , ó",Neutro
"Ah, é isso""","ah , ''",Neutro
Só eu sei os desertos que cruzei até aqui,sei desert cruz aqu,Neutro
(Hey! Pode pá),( hey ! pod pá ),Neutro
Tá lançada a sorte,tá lanç sort,Neutro
83 Era legal,83 legal,Neutro
"Sétima série eu tinha 13, pá e tal","sét séri 13 , pá tal",Neutro
Tudo era novo e o tempo brutal,tud nov temp brut,Negativo
O auge era o natal,aug natal,Neutro
Beijava a boca das mina,beij boc min,Neutro
Nas favelas de cima,favel cim,Neutro
Tinha um som e um clima bom,som clim bom,Positivo
O kit era o faroait,kit faroait,Neutro
O quente era o patchouli,quent patchoul,Neutro
O pica era o Djavan,pic djavan,Neutro
O hit era o Billy Jean,hit billy jean,Neutro
Do rock ao black as mais tops,rock black top,Neutro
Nos dias de mais sorte ouvia elas no Som Pop,dia sort ouv som pop,Neutro
Muleque magro e fraco invisível na esquina,mulequ magr frac invis esquin,Negativo
"Planejava a chacina da minha mente doente, hein!","planej chacin ment doent , hein !",Negativo
Sem pai nem parente nem sozinho entre feras,pai parent so fer,Negativo
Os malandro que era na miséria fizeram mal,malandr misér fiz mal,Negativo
Meu primo resolve ter revólver,prim resolv ter revólv,Negativo
"Em volta outras revoltas, envolve-se fácil","volt outr revolt , envolve-s fácil",Negativo
Era guerra com a favela de baixo,guerr favel baix,Negativo
"Sem livro, nem lápis, e o Brasil em colapso","livr , lápis , brasil colaps",Negativo
Quanto vale,quant val,Neutro
Quanto vale,quant val,Neutro
Quanto vale,quant val,Neutro
Quanto vale o show?,quant val show ?,Neutro
Aconteceu,acontec,Negativo
"Já é 86, subi aos 16 ao time principal","86 , sub 16 tim princip",Neutro
"Via em São Paulo tava mil grau, favela pra carai fi","via paul tav mil grau , favel pra car fi",Negativo
"Bar em bar, baile em baile, degrau pós degrau","bar bar , bail bail , degrau pó degrau",Neutro
Quanto baixo eu pude ir pobre muito mal,quant baix pud ir pobr mal,Negativo
"O preto vê mil chances de morrer, morô?","pret vê mil chanc morr , morô ?",Negativo
"Com roupas ou tênis sim, por que não?","roup tênil sim , ?",Neutro
"Artemis, benzina ou Optalidon","artemil , benzin optalidon",Neutro
"Tudo pela preza irmão, olha pra mim e diga","tud prez irm , olh pra mim dig",Neutro
Vale quanto pesa ou não?,val quant pes ?,Neutro
Quanto vale,quant val,Neutro
Quanto vale,quant val,Neutro
Quanto vale,quant val,Neutro
Quanto vale o show?,quant val show ?,Neutro
A César o que é de César primeira impressão,cés cés prim impress,Neutro
Os muleque tinha pressa mano,mulequ press man,Negativo
"Que funk louco, que onda é essa mano?","funk louc , ond man ?",Negativo
"E assim, meus parceirinho virou ladrão","assim , parce vir ladr",Negativo
"É que malandro é malandro mesmo, e várias fita","malandr malandr , vár fit",Negativo
"Era Bezerra era o que tava tendo, malandro rife","bezerr tav tend , malandr rif",Neutro
"Outros papo, outras gírias mais outras grifes","outr pap , outr gír outr grif",Neutro
"Cristian Dior, Samira, Le Coq Sportif","cristian di , sam , le coq sportif",Neutro
"Gshock eu tive sim, calça com pizza eu fiz","gshock sim , calç pizz fiz",Neutro
"Brasil é osso, ideia fixa eu tinha, porque","brasil oss , ide fix , porqu",Neutro
"Pardinho, igual eu assim, era um monte, uma pá","pard , igual assim , mont , pá",Negativo
"Fui garimpar, cruzei a ponte pra lá","garimp , cruz pont pra lá",Neutro
Hey zica,hey zic,Negativo
"Isso significa que era naquele pique, tocando repique de mão, jow","signif naquel piqu , toc repiqu mão , jow",Neutro
"No auge da Chic Show, nos traje, Curtis Blow era o cara","aug chic show , traj , curtil blow car",Neutro
"Curtição da massa, era luxo, só viver pra dançar","curt mass , lux , viv pra danç",Neutro
"Fui ver Sandra Sá, Whodini eu curti","ver sandr sá , whodin curt",Neutro
"A vitrine Pierre Cardin, Gucci, Fiorucci, Yves St Laurent, Indigo Blue","vitrin pierr cardin , gucc , fiorucc , yve st laurent , indig blu",Neutro
Corpo negro semi-nu encontrado no lixão em São Paulo,corp negr semi-nu encontr lix paul,Negativo
A última a abolir a escravidão,últ abol escrav,Negativo
"Dezembro sangrento SP, mundo cão promete","dezembr sangrent sp , mund cão promet",Negativo
"Nuvens e valas, chuvas de balas em 87","nuv val , chuv bal 87",Negativo
Quanto vale?,quant val ?,Neutro
Quanto vale o show?,quant val show ?,Neutro
Éh...,éh ...,Negativo
"Ai choque, a união é um sonho","ai choqu , uni sonh",Neutro
"Talvez só exista no céu,","talv exist céu ,",Neutro
"Se ta ligado, traidor é mato, e a traição tem gosto de ferro.","ta lig , trai mat , tra gost ferr .",Negativo
(Paw Paw Paw),( paw paw paw ),Negativo
"Nem é com nóis, mas se esconde ladrão,","nóil , escond ladr ,",Negativo
"Tem mais um judas sangrando na via, já passou sexta feira da paixão?","jud sangr via , pass sext feir paix ?",Negativo
"Nas ruas da sul, a tensão só aumenta, o amor agoniza, a misericórdia é rara..","rua sul , tens aument , am agoniz , misericórd rar ..",Negativo
"Uma cedônia no rosa, no pirajuçara..","cedôn ros , pirajuç ..",Neutro
"Mas enquanto ouver um filha da puta justo, essa porra ainda não ta perdida.","enquant ouv filh put just , porr aind ta perd .",Negativo
"Cachorro Loco Mano Brown, apresenta os comparças. Sabedoria de Vida","cachorr loc man brown , apresent comparç . sabed vid",Neutro
"Sinceramente é foda conseguir, alguma coisa na vida que nos faça feliz,","sinc fod consegu , algum cois vid faç feliz ,",Neutro
"Mas quem procura acha, pode vir que tem.","proc ach , pod vir .",Neutro
"Não tem valor quem, despreza tudo o que tem","val , despr tud",Negativo
"Tenho familia mãe, pai e irmãos também, todos me querem muito bem.","famil mãe , pai irm , tod quer bem .",Neutro
"Mas bem aqui é foda de ficar, tem uma pá de cara que quer nos derrubar.","bem aqu fod fic , pá car qu derrub .",Negativo
"A inveja que promove tudo isso, ele ainda fala que é nosso amigo, e diz que só quer o nosso bem.","invej promov tud , aind fal amig , diz qu bem .",Negativo
"Mas falso quenem ele eu não conheço ninguém, mas se você se tocou vamos mais além,","fals quen conheç ninguém , toc vam além ,",Neutro
"Sabedoria de vida, pode vir que tem.","sabed vid , pod vir .",Neutro
"Quem procura acha, pode vir que tem. (Vem vem, pode vir que tem)","proc ach , pod vir . ( vem vem , pod vir )",Neutro
Mano que é mano não tira Ninguém.,man man tir ninguém .,Neutro
"Tem o que você quiser, e imaginar, pagou um pau já era, pode acreditar.","quis , imagin , pag pau , pod acredit .",Neutro
"Não quero te matar, apenas te alertar apenas uma frase pode te derrubar.","quer mat , apen alert apen fras pod derrub .",Negativo
"Uma frase feita com sabedoria, scrash, rimas e sabedoria","fras feit sabed , scrash , rim sabed",Neutro
Racistas otários nos deixem em paz,racist otári deix paz,Negativo
Pois as famílias pobres não aguentam mais,poi famíl pobr aguent,Negativo
Pois todos sabem e elas temem,poi tod sab tem,Negativo
A indiferença por gente carente que se tem,indiferenç gent carent,Negativo
E eles veem,ve,Neutro
Por toda autoridade o preconceito eterno,tod autoridad preconceit etern,Negativo
E de repente o nosso espaço se transforma,repent espaç transform,Neutro
Num verdadeiro inferno e reclamar direitos,verd infern reclam direit,Negativo
De que forma,form,Neutro
Se somos meros cidadãos,mer cidad,Neutro
E eles o sistema,sistem,Neutro
E a nossa desinformação é o maior problema,desinform mai problem,Negativo
Mas mesmo assim enfim,assim enfim,Negativo
Queremos ser iguais,quer igual,Neutro
Racistas otários nos deixem em paz,racist otári deix paz,Negativo
Racistas otários nos deixem em paz,racist otári deix paz,Negativo
Justiça,justiç,Neutro
Em nome disse eles são pagos,nom diss pag,Neutro
Mas a noção que se tem,noç,Neutro
É limitada e eu sei,limit sei,Neutro
Que a lei,lei,Neutro
É implacável com os oprimidos,implac oprim,Negativo
Tornam bandidos os que eram pessoas de bem,torn band pesso bem,Negativo
Pois já é tão claro que é mais fácil dizer,poi tão clar fácil diz,Neutro
Que eles são os certos e o culpado é você,cert culp,Negativo
Se existe ou não a culpa,exist culp,Negativo
Ninguém se preocupa,ninguém preocup,Neutro
Pois em todo caso haverá sempre uma desculpa,poi tod cas hav sempr desculp,Negativo
O abuso é demais,abus demal,Negativo
Pra eles tanto faz,pra tant faz,Neutro
Não passará de simples fotos nos jornais,pass simpl fot jorn,Neutro
Pois gente negra e carente,poi gent negr carent,Negativo
Não muito influente,influ,Neutro
E pouco frequente nas colunas sociais,pouc frequ colun soc,Neutro
Então eu digo meu rapaz,ent dig rapaz,Neutro
Esteja constante ou abrirão o seu bolso,const abr bols,Neutro
E jogarão um flagrante num presídio qualquer,jog flagr presídi qualqu,Negativo
Será um irmão a mais,irm,Neutro
Racistas otários nos deixem em paz,racist otári deix paz,Negativo
Racistas otários nos deixem em paz,racist otári deix paz,Negativo
Então a velha história outra vez se repete,ent velh histór outr vez repet,Negativo
Por um sistema falido,sistem fal,Negativo
Como marionetes nós somos movidos,marionet mov,Neutro
E há muito tempo tem sido assim,temp sid assim,Neutro
Nos empurram à incerteza e ao crime enfim,empurr incert crim enfim,Negativo
Porque aí certamente estão se preparando,porqu aí cert prepar,Neutro
Com carros e armas nos esperando,carr arm esper,Negativo
E os poderosos me seguram observando,poder segur observ,Neutro
O rotineiro Holocausto urbano,rotin holocaust urban,Negativo
O sistema é racista cruel,sistem racist cruel,Negativo
Levam cada vez mais,lev cad vez,Neutro
Irmãos aos bancos dos réus,irm banc réu,Negativo
Os sociólogos preferem ser imparciais,sociólog pref imparc,Neutro
E dizem ser financeiro o nosso dilema,diz financ dilem,Neutro
Mas se analisarmos bem mais você descobre,analis bem descobr,Neutro
Que negro e branco pobre se parecem,negr branc pobr parec,Neutro
Mas não são iguais,igual,Neutro
Crianças vão nascendo,crianç vão nasc,Neutro
Em condições bem precárias,cond bem precár,Negativo
Se desenvolvendo sem a paz necessária,desenvolv paz necessár,Negativo
São filhos de pais sofridos,filh pal sofr,Negativo
E por esse mesmo motivo,motiv,Neutro
Nível de informação é um tanto reduzido,nível inform tant reduz,Negativo
Não,,Neutro
É um absurdo,absurd,Negativo
São pessoas assim que se fodem com tudo,pesso assim fod tud,Neutro
E que no dia a dia vive tensa e insegura,dia dia viv tens inseg,Negativo
E sofre as covardias humilhações torturas,sofr covard humilh tort,Negativo
A conclusão é sua KL Jay,conclus kl jay,Neutro
Porém direi para vocês irmãos,porém dir irm,Neutro
Nossos motivos pra lutar ainda são os mesmos,motiv pra lut aind mesm,Neutro
O preconceito e desprezo ainda são iguais,preconceit desprez aind igual,Negativo
Nós somos negros também temos nossos ideais,negr ideal,Neutro
Racistas otários nos deixem em paz,racist otári deix paz,Negativo
Racistas otários nos deixem em paz,racist otári deix paz,Negativo
Os poderosos são covardes desleais,poder cov desleal,Negativo
Espancam negros nas ruas por motivos banais,espanc negr rua motiv banal,Negativo
E nossos ancestrais,ancestr,Negativo
Por igualdade lutaram,igualdad lut,Neutro
Se rebelaram morreram,rebel morr,Negativo
E hoje o que fazemos,hoj faz,Neutro
Assistimos a tudo de braços cruzados,assist tud braç cruz,Negativo
Até parece que nem somos nós os prejudicados,parec prejudic,Negativo
Enquanto você sossegado foge da questão,enquant sosseg fog quest,Negativo
Eles circulam na rua com uma descrição,circul rua descr,Neutro
Que é parecida com a sua,parec,Neutro
Cabelo cor e feição,cabel cor feiçã,Neutro
Será que eles veem em nós um marginal padrão,ve marg padr,Negativo
50 anos agora se completam,50 ano agor complet,Neutro
Da lei antirracismo na constituição,lei antirrac constitu,Neutro
Infalível na teoria,infal teor,Neutro
Inútil no dia a dia,inútil dia dia,Neutro
Então que fodam-se eles com sua demagogia,ent fodam-s demagog,Negativo
No meu país o preconceito é eficaz,país preconceit eficaz,Negativo
Te cumprimentam na frente,cumpriment frent,Neutro
E te dão um tiro por trás,dão tir trá,Negativo
O Brasil é um país de clima tropical,brasil país clim tropic,Neutro
Onde as raças se misturam naturalmente,ond raç mistur natur,Neutro
"E não há preconceito racial ha, ha","preconceit rac ha , ha",Neutro
Nossos motivos pra lutar ainda são os mesmos,motiv pra lut aind mesm,Neutro
O preconceito e o desprezo ainda são iguais,preconceit desprez aind igual,Negativo
Nós somos negros também temos nossos ideais,negr ideal,Neutro
Racistas otários nos deixem em paz,racist otári deix paz,Negativo
Parece que alguém está me carregando perto do chão,parec alguém carreg pert chã,Negativo
"Parece um sonho, parece uma ilusão","parec sonh , parec ilusã",Negativo
"A agonia, o desespero toma conta de mim","agon , desesper tom cont mim",Negativo
Algo no ar me diz que é muito ruim,alg ar diz ruim,Negativo
Meu sangue quente. Não sinto dor,sang quent . sint dor,Negativo
A mão dormente não sente o próprio suor,mão dorm sent própri su,Negativo
Meu raciocínio fica meio devagar,raciocíni fic mei devag,Neutro
Quem me fodeu?,fod ?,Negativo
Eu tô tentando me lembrar,tô tent lembr,Neutro
Cresceu o movimento ao meu redor,cresc mov redor,Positivo
Meu Deus! Eu não sei mais o que é pior,deu ! sei pi,Negativo
Mentir a vida toda pra si mesmo,ment vid tod pra si,Neutro
Ou continuar e insistir no mesmo erro,continu insist err,Negativo
Me lembro de um fulano,lembr fulan,Neutro
Mata esse mano!,mat man !,Negativo
Será que errar dessa forma é humano?,err dess form human ?,Negativo
Errar a vida inteira é muito fácil,err vid int fácil,Negativo
Pra sobreviver aqui tem que ser mágico,pra sobreviv aqu mágic,Neutro
Me lembro de várias coisas ao mesmo tempo,lembr vár cois temp,Neutro
Como se eu estivesse perdendo tempo,perd temp,Negativo
A ironia da vida é foda!,iron vid fod !,Negativo
Que valor tem? Quanto valor tem?,val ? quant val ?,Neutro
"Uma vida vale muito, vim saber agora","vid val , vim sab agor",Neutro
"Deitado aqui e os manos na paz, tudo lá fora","deit aqu man paz , tud lá",Neutro
Puxando ferro ou talvez batendo uma bola,pux ferr talv bat bol,Neutro
Pode crer. Deve tá mó Lua da hora,pod cr . dev tá mó lua hor,Negativo
"Tem alguém me chamando, quem é?","alguém cham , ?",Neutro
"Apertando minha mão, tem voz de mulher","apert mão , voz mulh",Neutro
O choro a faz engolir as palavras,chor faz engol palavr,Negativo
Um lenço que enxuga meu suor enxuga suas próprias lágrimas,lenç enxug su enxug própr lágr,Neutro
No rosto de uma mãe que ora baixinho,rost mãe ora baix,Neutro
"Que nunca me deixou faltar, ficar sozinho","nunc deix falt , fic so",Negativo
Me ensinou o caminho desde criança,ensin caminh desd crianç,Neutro
"Minha infância, mais uma eu guardo na lembrança","infânc , guard lembranç",Neutro
Na esperança da periferia eu sou mais um,esperanç perif,Neutro
"Clic, clec, bum!","clic , clec , bum !",Negativo
Rapaz comum,rapaz comum,Neutro
"Clic, clec, bum!","clic , clec , bum !",Negativo
A lei da selva é assim,lei selv assim,Neutro
"Clic, clec, bum!","clic , clec , bum !",Negativo
Rapaz comum,rapaz comum,Neutro
A lei da selva é assim,lei selv assim,Neutro
"Clic, clec, bum!","clic , clec , bum !",Negativo
Predatória,predatór,Neutro
Rapaz comum,rapaz comum,Neutro
Preserve a sua glória!,preserv glór !,Neutro
Queria atrasar o meu relógio,quer atras relógi,Negativo
Pra mim vale muito um minuto a mais de ódio,pra mim val minut ódi,Negativo
"Mas me sinto fraco, indefeso, desprotegido","sint frac , indefes , desproteg",Negativo
"Eu vou mais alto, cusão! Pra te levar comigo!","vou alt , cus ! pra lev comig !",Negativo
Vou ser um encosto na sua vida,vou encost vid,Neutro
"Você criou um monstro sem cura, sem alternativa!","cri monstr cur , altern !",Negativo
Me enganar pra quê?,engan pra quê ?,Negativo
Se o fim é virar pó!,fim vir pó !,Negativo
Fiquei muito pior,fiq pi,Negativo
Segura o seu B.O.!,segur b.o . !,Neutro
O preto aqui não tem dó!,pret aqu dó !,Neutro
Mais uma vida desperdiçada e é só,vid desperdiç,Negativo
Uma bala vale por uma vida do meu povo,bal val vid pov,Neutro
"No pente tem quinze, sempre há menos no morro, e então?","pent quinz , sempr menos morr , ent ?",Neutro
Quantos manos iguais a mim se foram?,quant man igual mim ?,Negativo
"Preto, preto, pobre, cuidado, socorro!","pret , pret , pobr , cuid , socorr !",Negativo
Quê que pega aqui? Quê que acontece ali?,quê peg aqu ? quê acontec ali ?,Negativo
"Vejo isso frequentemente, desde moleque","vej frequ , desd molequ",Neutro
"Quinze de idade já era o bastante, então","quinz idad bast , ent",Neutro
"Treta no baile, então. Tiros de monte!","tret bail , ent . tir mont !",Negativo
Morte nem se fala!,mort fal !,Negativo
Eu vejo o cara agonizando!,vej car agoniz !,Negativo
Chame a ambulância! Alguém chame a ambulância!,cham ambulânc ! alguém cham ambulânc !,Negativo
Depois ficava sabendo na semana,fic sab seman,Neutro
Que dois já era,doi,Neutro
Os preto sempre teve fama,pret sempr fam,Neutro
"No jornal, revista e TV se vê","jorn , revist tv vê",Neutro
"Morte aqui é natural, é comum de se ver","mort aqu natur , comum ver",Negativo
Caralho! Não quero ter que achar normal,caralh ! quer ter ach norm,Neutro
Ver um mano meu coberto de jornal!,ver man cobert jorn !,Neutro
É mal! Cotidiano suicida!,mal ! cotidi suic !,Negativo
Quem entra tem passagem só pra ida!,entr pass pra ida !,Neutro
Me diga. Me diga: Que adianto isso faz?,dig . dig : adiant faz ?,Neutro
Me diga. Me diga: Que vantagem isso traz?,dig . dig : vantag traz ?,Neutro
Então,ent,Negativo
A fronteira entre o Céu e o Inferno tá na sua mão,fronteir céu infern tá mão,Negativo
Nove milímetros de ferro,nov milímetr ferr,Neutro
Cusão! Otário! Que pôrra é você?,cus ! otári ! pôrr ?,Negativo
Olha no espelho e tenta entender,olh espelh tent entend,Neutro
A arma é uma isca pra fisgar,arm isc pra fisg,Neutro
Você não é polícia pra matar!,políci pra mat !,Negativo
