Linha Original,Linha Pré-processada,Sentimento
Aham,ah,Negativo
Vai vendo a fita,vai vend fit,Neutro
Cê não acredita,cê acredit,Negativo
"Quando tem que se é Jão, (hã) pres'tenção","jão , ( hã ) pres'tenç",Neutro
Vai vendo: Parei pra fumar um de remédio,vai vend : par pra fum remédi,Negativo
"Com uns muleque lá e pá, trafica nos prédios","um mulequ lá pá , traf prédi",Neutro
"Um que chegou depois, pediu pra dar uns 2","cheg , ped pra dar um 2",Negativo
"Qual, um patrício ó, novão e os carái",", patríci ó , nov cará",Neutro
"Fumaça vai, fumaça vem ele chapou o coco","fumaç vai , fumaç vem chap coc",Negativo
"Se abriu que nem uma flor, ficou louco","abr fl , fic louc",Negativo
"Tava eu, mais dois truta e uma mina","tav , doi trut min",Neutro
"Num Tempra prata, show filmado, ouvindo Guina","tempr prat , show film , ouv guin",Neutro
"Ih, o bico se atacou ó, falou uma pá do cê","ih , bic atac ó , fal pá cê",Negativo
Tipo o quê?,tip quê ?,Neutro
Esse Brown aí é cheio de querer ser,brown aí chei quer,Neutro
Deixa ele moscar e cantar na quebrada,deix mosc cant quebr,Negativo
Vamo ver se é isso tudo quando ver as quadrada,vam ver tud ver quadr,Neutro
"Periferia nada, só pensa nele mesmo","perif nad , pens nel",Negativo
Montado no dinheiro e cês aí no veneno,mont dinh cê aí venen,Neutro
"E a cara dele, truta?","car , trut ?",Neutro
Cada um no seu corre,cad corr,Neutro
"Tudo pelas verde, uns mata, outros morrem","tud verd , um mat , outr morr",Negativo
"Eu mesmo se eu catar, voa numa hora dessa","cat , voa hor dess",Neutro
Vou me destacar do outro lado de pressa,vou destac outr lad press,Neutro
"Vou comprar uma house de boy, depois alugo","vou compr hous boy , alug",Neutro
"Vão me chamar de senhor, não por vulgo","vão cham senh , vulg",Neutro
Mas pra ele só a zona sul que é a pá,pra zon sul pá,Neutro
"Diz que ele tira nós, nossa cara é cobrar","diz tir , car cobr",Negativo
"O que ele quiser nós quer, vem que tem","quis qu , vem",Neutro
Porque eu não pago pau pra ninguém,porqu pag pau pra ninguém,Negativo
"E eu? Só registrei né, não era de lá","? registr né , lá",Neutro
"Os mano tudo só ouviu, ninguém falou um A","man tud ouv , ninguém fal",Negativo
Quem tem boca fala o que quer pra ter nome,boc fal qu pra ter nom,Neutro
Pra ganhar atenção das muié e/ou dos homens,pra ganh atenç muié e/ou hom,Neutro
"Amo minha raça, luto pela cor","amo raç , lut cor",Negativo
"O que quer que eu faça é por nós, por amor","qu faç , am",Neutro
"Não entende o que eu sou, não entende o que eu faço","entend , entend faç",Negativo
Não entende a dor e as lágrimas do palhaço,entend dor lágr palh,Negativo
Mundo em decomposição por um triz,mund decompos triz,Negativo
Transforma um irmão meu num verme infeliz,transform irm verm infeliz,Negativo
E a minha mãe diz,mãe diz,Neutro
"Paulo, acorda, pensa no futuro que isso é ilusão","paul , acord , pens futur ilusã",Neutro
Os próprio preto não tá nem aí com isso não,própri pret tá aí,Neutro
"Olha o tanto que eu sofri, que eu sou, o que eu fui","olh tant sofr , ,",Negativo
"A inveja mata um, tem muita gente ruim","invej mat , muit gent ruim",Negativo
"Pô, mãe, não fala assim que eu nem durmo","pô , mãe , fal assim durm",Neutro
Meu amor pela senhora já não cabe em Saturno,am senh cab saturn,Neutro
"Dinheiro é bom, quero sim, se essa é a pergunta","dinh bom , quer sim , pergunt",Neutro
Mas a dona Ana fez de mim um homem e não uma puta!,don ana fez mim hom put !,Neutro
"Ei, você, seja lá quem for, pra semente eu não vim","ei , , lá , pra sement vim",Neutro
"Então, sem terror","ent , terr",Neutro
"Inimigo invisível, Judas incolor","inimig invis , jud incol",Negativo
"Perseguido eu já nasci, demorou","persegu nasc , demor",Negativo
Apenas por 30 moedas o irmão corrompeu,apen 30 moed irm corromp,Negativo
Atire a primeira pedra quem tem rastro meu,atir prim pedr rastr,Negativo
"Cadê meu sorriso? Onde tá? É, quem roubou?","cad sorris ? ond tá ? , roub ?",Negativo
"Humanidade é má, e até Jesus Chorou","human má , jesu chor",Negativo
Lágrimas,lágr,Negativo
Lágrimas,lágr,Negativo
Lágrimas,lágr,Negativo
Jesus Chorou,jesu chor,Negativo
"Vermelho e azul, hotel, pisca só no","vermelh azul , hotel , pisc",Neutro
Cinza escuro do céu,cinz escur céu,Negativo
Chuva cai lá fora e aumenta o ritmo,chuv cai lá aument ritm,Negativo
Sozinho eu sou agora o meu inimigo íntimo,so agor inimig íntim,Negativo
"Lembranças más vem, pensamentos bons vai","lembranç má vem , pens bom vai",Negativo
"Me ajude, sozinho penso merda pra carai","ajud , so pens merd pra car",Negativo
"Gente que acredito, gosto e admiro","gent acredit , gost admir",Neutro
Brigava por justiça e paz levou tiro,brig justiç paz lev tir,Negativo
"Malcom X, Ghandi, Lennon, Marvin Gaye","malcom x , ghand , lennon , marvin gay",Negativo
"Che Guevara, 2Pac, Bob Marley","che guev , 2pac , bob marley",Neutro
E o evangélico Martin Luther King,evangél martin luth king,Neutro
Lembrei de um truta meu falar assim,lembr trut fal assim,Neutro
Não joga pérolas aos porcos irmão,jog pérol porc irm,Negativo
"Joga lavagem, eles prefere assim","jog lav , pref assim",Neutro
Cê tem de usar piolhagem!,cê us piolh !,Negativo
Cristo que morreu por milhões,crist morr milhã,Negativo
Mas só andou com apenas 12 e um fraquejou,and apen 12 fraquej,Negativo
Periferia: Corpos vazios e sem ética,perif : corp vazi étic,Negativo
Lotam os pagode rumo à cadeira elétrica,lot pagod rum cade elétr,Neutro
"Eu sei, você sabe o que é frustração","sei , sab frustr",Negativo
Máquina de fazer vilão,máquin faz vil,Neutro
"Eu penso mil fita, vou enlouquecer","pens mil fit , vou enlouquec",Negativo
E o piolho diz assim quando me vê,piolh diz assim vê,Negativo
"Famoso pra caraio, durão, ih, truta","fam pra carai , dur , ih , trut",Neutro
"Faz seu mundo não, Jão, hã, a vida é curta","faz mund , jão , hã , vid curt",Neutro
Só modelo por aí dando boi,model aí dand boi,Negativo
Põe elas pra chupar e manda andar depois,põe pra chup mand and,Neutro
Rasgar as madrugadas só de mil e cem,rasg madrug mil cem,Negativo
"Se sou eu truta, não tem pra ninguém","trut , pra ninguém",Negativo
"Zé Povinho é o Cão, tem esses defeitos","zé pov cão , defeit",Negativo
Quê? Cê tendo ou não cresce os zóio de qualquer jeito,quê ? cê tend cresc zói qualqu jeit,Negativo
"Cruzar se arrebentar, de repentemente vai","cruz arrebent , repent vai",Negativo
"De ponto quarenta, só querer tá no pente","pont quarent , quer tá pent",Neutro
Se só de pensar em matar já matou,pens mat mat,Negativo
Eu prefiro ouvir o pastor,prefir ouv pastor,Neutro
"Filho meu, não inveje o homem violento","filh , invej hom violent",Neutro
E nem siga nenhum dos seus caminhos,sig nenhum caminh,Neutro
Lágrimas molham a medalha de um vencedor,lágr molh medalh venc,Negativo
"Chora agora ri depois, irmão, Jesus chorou","chor agor ri , irm , jesu chor",Negativo
Jesus chorou,jesu chor,Negativo
Jesus chorou,jesu chor,Negativo
Jesus chorou,jesu chor,Negativo
Humanidade é má e até Jesus Chorou,human má jesu chor,Negativo
Jorge sentou praça,jorg sent praç,Neutro
Na cavalaria,caval,Negativo
E eu estou feliz porque eu também,feliz porqu,Neutro
Sou da sua companhia,companh,Neutro
Eu estou vestido com as roupas,vest roup,Neutro
E as armas de Jorge,arm jorg,Neutro
Para que meus inimigos tenham pés,inimig pé,Negativo
E não me alcancem,alcanc,Negativo
Para que meus inimigos tenham mãos,inimig mão,Neutro
E não me toquem,toqu,Neutro
Para que meus inimigos tenham olhos,inimig olh,Neutro
E não me vejam,vej,Neutro
E nem mesmo em pensamento eles possam ter,pens poss ter,Neutro
Para me fazerem mal,faz mal,Negativo
Armas de fogo,arm fog,Negativo
Meu corpo não alcançarão,corp alcanç,Neutro
Facas e espadas se quebrem,fac esp quebr,Negativo
Sem o meu corpo tocar,corp toc,Negativo
Cordas e correntes arrebentem,cord corr arrebent,Negativo
Sem o meu corpo amarrar,corp amarr,Negativo
Pois eu estou vestido com as roupas,poi vest roup,Neutro
E as armas de Jorge,arm jorg,Neutro
Jorge é de Capadócia,jorg capadóc,Neutro
Salve Jorge,salv jorg,Neutro
Salve Jorge,salv jorg,Neutro
Jorge é de Capadócia,jorg capadóc,Neutro
Salve Jorge,salv jorg,Neutro
Salve Jorge,salv jorg,Neutro
"Você não tem amor próprio, fulano!","am própri , fulan !",Negativo
"Nos envergonha, pensa que é o maior.","envergonh , pens mai .",Negativo
"Não passa de um sem vergonha, em seus atos!","pass vergonh , ato !",Negativo
Por si só define sua personalidade.,si defin personal .,Neutro
Mas é a inferioridade que você sente no fundo.,inferior sent fund .,Negativo
Dá aos racistas imundos,dá racist imund,Negativo
razões o bastante pra prosseguirem nos fodendo como antes.,ra bast pra prossegu fod ant .,Neutro
"Ovelha branca da raça, traidor!","ovelh branc raç , trai !",Negativo
"Vendeu a alma ao inimigo, renegou sua cor!","vend alm inimig , reneg cor !",Negativo
"Mas nosso júri é racional, não falha!","júr racion , falh !",Neutro
Por que?,?,Neutro
Não somos fãs de canalha!,fã canalh !,Negativo
Existe um velho ditado do cativeiro que diz:,exist velh dit cativ diz :,Neutro
que o negro sem orgulho é fraco e infeliz.,negr orgulh frac infeliz .,Negativo
Como uma grande árvore que não tem raiz.,grand árvor raiz .,Negativo
"Mas se assim você quis, então terá que pagar!","assim quil , ent pag !",Neutro
"Porém agora os playboys, querem mais é que se foda!","porém agor playboy , quer fod !",Neutro
Você e e a sua raça toda!,raç tod !,Negativo
Eles nem pensam em te ajudar!,pens ajud !,Neutro
Então! Olhe pra você e lembre dos irmãos!,ent ! olh pra lembr irm !,Neutro
"Com o sangue espalhado, fizeram muitas notícias!","sang espalh , fiz muit notíc !",Negativo
"Mortos na mão da polícia, fuzilados de bruços no chão.","mort mão políci , fuzil bruç chã .",Negativo
Me causa raiva e indignação,caus raiv indign,Negativo
a sua indiferença quanto à nossa destruição!,indiferenç quant destru !,Negativo
"Mas, o nosso júri é racional, não falha!",", júr racion , falh !",Neutro
Não somos fã de canalha! (2x),fã canalh ! ( 2x ),Negativo
"As vagabundas que você a vida toda elogiara,","vagabund vid tod elogi ,",Negativo
"Se divertem hoje, e riem da sua cara.","divert hoj , ri car .",Neutro
"Aquelas vacas usufruíram, usaram do pouco que você tinha","vac usufru , us pouc",Neutro
até a última gota!,últ got !,Negativo
"No entanto, não há outra...","entant , outr ...",Neutro
E agora?,agor ?,Neutro
"Você foi desprezado, jogado fora!","desprez , jog !",Negativo
Você não precisa delas!,precis !,Neutro
"Se existem negras tão belas, e pode ter as melhores,","exist negr tão bel , pod ter melhor ,",Neutro
Por que ficar com as piores?,fic pi ?,Negativo
"Burguesas cadelas? pode crer,","burgu cadel ? pod cr ,",Negativo
"estou falando sobre nossa auto-estima,","fal sobr auto-est ,",Neutro
voce despreza seu irmão não dá a mínima;,voc despr irm dá mín ;,Negativo
"mas nosso júri é racional, não falha!","júr racion , falh !",Neutro
Não somos fã de canalha! (2x),fã canalh ! ( 2x ),Negativo
"""Aqui é o Mano Brown, descendente negro atual,","`` aqu man brown , descend negr atual ,",Neutro
"Você está no júri racional e será julgado, otário!","júr racion julg , otári !",Negativo
por ter jogado no time contrário.,ter jog tim contr .,Negativo
"O nosso júri é racional, não falha.","júr racion , falh .",Neutro
Não somos fã de canalha.,fã canalh .,Neutro
"Prossiga mano Edy Rock e tal.""",prossig man edy rock tal . '',Neutro
"Gosto de Nelson Mandela, admiro Spike Lee.","gost nelson mandel , admir spik lee .",Neutro
"Zumbi, um grande herói, o maior daqui.","zumb , grand heró , mai daqu .",Neutro
"São importantes pra mim, mas você ri e dá as costas.","import pra mim , ri dá cost .",Negativo
Então acho que sei da porra que você gosta:,ent ach sei porr gost :,Neutro
"Se vestir como playboy, frequentar danceterias,","vest playboy , frequent dancet ,",Neutro
"agradar as vagabundas, ver novela todo dia,","agrad vagabund , ver novel tod dia ,",Neutro
que merda!,merd !,Negativo
"Se esse é seu ideal, é lamentável!","ideal , lament !",Negativo
"É bem provável que você se foda muito,","bem prov fod ,",Negativo
você se auto-destrói e também quer nos incluir.,auto-destró qu inclu .,Neutro
"Porém, não quero, não gosto, sou negro, não posso,","porém , quer , gost , negr , poss ,",Negativo
não vou admitir!,vou admit !,Negativo
"Do que valem roupas caras, se não tem atitude?","val roup car , atitud ?",Negativo
"Do que vale a negritude, se não pô-la em prática?","val negritud , pô-l prát ?",Neutro
"A principal tática, herança de nossa mãe África!","princip tátic , heranç mãe áfric !",Neutro
A única coisa que não puderam roubar!,únic cois pud roub !,Negativo
"Se soubessem o valor que a nossa raça tem,","soub val raç ,",Neutro
tingiam a palma da mão pra ser escura também !,ting palm mão pra escur !,Neutro
"Mas nosso júri é racional, não falha!","júr racion , falh !",Neutro
Não somos fã de canalha!,fã canalh !,Negativo
"O nosso júri é racional, não falha!","júr racion , falh !",Neutro
Não somos fã de canalha! (2x),fã canalh ! ( 2x ),Negativo
"Quero nos devolver o valor, que a outra raça tirou.","quer devolv val , outr raç tir .",Neutro
"Esse é meu ponto de vista. Não sou racista, morou?","pont vist . racist , mor ?",Neutro
"Escravisaram sua mente e muitos da nossa gente,","escravis ment muit gent ,",Negativo
"mas você, infelizmente,",", infeliz ,",Negativo
sequer demonstra interesse em se libertar.,sequ demonstr inter libert .,Neutro
Essa é a questão: auto-valorização.,quest : auto-valor .,Neutro
Esse é o título da nossa revolução.,títul revoluç .,Neutro
Capítulo 1:,capítul 1 :,Neutro
O verdadeiro negro tem que ser capaz,verd negr capaz,Neutro
"de remar contra a maré, contra qualquer sacrifício.","rem contr maré , contr qualqu sacrifíci .",Negativo
Mas no seu caso é difícil: você só pensa no seu benefício.,cas difícil : pens benefíci .,Neutro
"Desde o início, me mostram indícios","desd iníci , mostr indíci",Neutro
"que seus artifícios são vistos pouco originais,anormais,","artifíci vist pouc orig , anorm ,",Negativo
"artificiais, embranquiçados demais.","artific , embranquiç demal .",Negativo
"Ovelha branca da raça, traidor!","ovelh branc raç , trai !",Negativo
"Vendeu a alma ao inimigo, renegou sua cor.","vend alm inimig , reneg cor .",Negativo
"Mas nosso júri é racional, não falha!","júr racion , falh !",Neutro
Por quê? Não somos fã de canalha!,quê ? fã canalh !,Neutro
"""Por unanimidade,","`` unanim ,",Neutro
o júri deste tribunal declara a ação procedente.,júr dest tribun decl açã proced .,Negativo
E considera o réu culpado,consid réu culp,Negativo
Por ignorar a luta dos antepassados negros,ignor lut antepass negr,Negativo
Por menosprezar a cultura negra milenar.,menosprez cult negr milen .,Negativo
Por humilhar e ridicularizar os demais irmãos.,humilh ridicular demal irm .,Negativo
Sendo instrumento voluntário do inimigo racista.,send instrument voluntári inimig racist .,Negativo
"Caso encerrado.""",cas encerr . '',Negativo
"As noites pilotam os sonhos de quem quer ter prazer,","noit pilot sonh qu ter praz ,",Neutro
mas a noite meu irmão nem sempre é boa pra você!,noit irm sempr boa pra !,Negativo
Suas baladas pela noite traduzem suas,bal noit traduz,Neutro
vontades mais extremas,vontad extrem,Negativo
Mas se tudo acontece é porque tem que acontecer porque a,tud acontec porqu acontec porqu,Negativo
importância de ampliar as idéias foi deixada prá trás,import ampli idé deix prá trá,Neutro
Nem tive tempo de pensar nas falhas,temp pens falh,Negativo
Eu aprendi do pior jeito à rebelia da estrada,aprend pi jeit rebel estr,Negativo
Poucos acertos muitas noites de perigo,pouc acert muit noit perig,Negativo
"Pela história fui salvo, mas perdi grandes amigos","histór salv , perd grand amig",Negativo
"Na noite tudo se pode, horas","noit tud pod , hor",Neutro
abertas são o cenário ideal,abert cen ideal,Neutro
prá quem vai na contramão,prá vai contr,Negativo
Você diz que é mafioso e que é ladrão,diz mafi ladr,Negativo
Faz tudo errado e os outros pagam por você meu irmão!,faz tud err outr pag irm !,Negativo
Você diz que é mafioso é que é ladrão,diz mafi ladr,Negativo
Faz tudo errado e os outros pagam por você ladrão!,faz tud err outr pag ladr !,Negativo
Ele adorava uma arma,ador arm,Neutro
todo mundo ele aloprava,tod mund alopr,Negativo
com seu jeito meio clépto de ser,jeit mei clépt,Neutro
"Zé Bonitão, todo função, Rambo Vilão","zé bonit , tod funç , ramb vil",Neutro
Herói da gang juvenil pesadelo do Brasil,heró gang juvenil pesadel brasil,Negativo
Mas se tudo acontece é porque tem que acontecer,tud acontec porqu acontec,Neutro
porque a importância de ampliar as idéias,porqu import ampli idé,Neutro
foi dexada prá trás.,dex prá trá .,Negativo
Nem tive tempo de pensar nas falhas!,temp pens falh !,Negativo
Eu aprendi do pior jeito à revelia na estrada,aprend pi jeit revel estr,Negativo
"Poucos acertos, muitas noites de perigo","pouc acert , muit noit perig",Negativo
"Pela história fui salvo, mas perdi grandes amigos","histór salv , perd grand amig",Negativo
Na noite tudo se pode horas abertas são,noit tud pod hor abert,Neutro
o cenário ideal pra quem vai na contra mão,cen ideal pra vai contr mão,Neutro
Você diz que é mafioso e que é ladrão,diz mafi ladr,Negativo
Faz tudo errado e os outros pagam por você meu irmão!,faz tud err outr pag irm !,Negativo
Você diz que é mafioso e que é ladrão,diz mafi ladr,Negativo
Faz tudo errado e os outros pagam por você ladrão!,faz tud err outr pag ladr !,Negativo
A Lua cheia clareia as ruas do capão,lua chei clare rua cap,Neutro
"Acima de nós só Deus, humilde, né, não? Né, não?","acim deu , humild , né , ? né , ?",Neutro
Saúde! Plin! Mulher e muito som,saúd ! plin ! mulh som,Neutro
"Vinho branco para todos, um advogado bom","vinh branc tod , advog bom",Neutro
"Cof, cof, ah! Esse frio tá de fuder","cof , cof , ah ! fri tá fud",Negativo
"Terça-feira é ruim de rolê, vou fazer o quê?","terça-f ruim rol , vou faz quê ?",Negativo
Nunca mudou nem nunca mudará,nunc mud nunc mud,Neutro
O cheiro de fogueira vai perfumando o ar,cheir fogu vai perfum ar,Neutro
"Mesmo céu, mesmo cep no lado sul do mapa","céu , cep lad sul map",Negativo
Sempre ouvindo um rap para alegrar a rapa,sempr ouv rap alegr rap,Neutro
Nas ruas da sul eles me chamam brown,rua sul cham brown,Neutro
"Maldito, vagabundo, mente criminal","maldit , vagabund , ment crim",Negativo
O que toma uma taça de champanhe também curte,tom taç champanh curt,Neutro
"Desbaratinado, tubaína tutti-frutti","desbaratin , tubaín tutti-frutt",Negativo
"Fanático, melodramático, bon-vivant","faná , melodramá , bon-vivant",Neutro
"Depósito de mágoa, quem está certo é os saddam, ham","depósit mágo , cert sadd , ham",Negativo
"Playboy bom é chinês, australiano","playboy bom chin , australi",Neutro
"Fala feio e mora longe, não me chama de mano","fal fei mor long , cham man",Negativo
"Ei, brother, hey, uhul! Pau no seu- ai","ei , broth , hey , uhul ! pau seu- ai",Neutro
"Três vezes seu sofredor, eu odeio todos vocês","trê vez sofr , odei tod",Negativo
Vem de artes marciais que eu vou de sig sauer,vem art marc vou sig sau,Neutro
Quero sua irmã e seu relógio tag heuer,quer irmã relógi tag heu,Neutro
"Um conto, se pá′, dá pra catar","cont , pá′ , dá pra cat",Neutro
Ir para a quebrada e gastar antes do galo cantar,ir quebr gast ant gal cant,Negativo
Um triplex para a coroa é o que malandro quer,triplex coro malandr qu,Neutro
Não só desfilar de Nike no pé,desfil nik pé,Neutro
"Ô, vem com a minha cara e o din-din do seu pai","ô , vem car din-din pai",Neutro
Mas pro rolê com nóis cê não vai,pro rol nóil cê vai,Neutro
"Nós aqui, vocês lá, cada um no seu lugar","aqu , lá , cad lug",Neutro
"Entendeu? Se a vida é assim, tem culpa eu?","entend ? vid assim , culp ?",Negativo
"Se é o crime ou o creme, se não deves não teme","crim crem , dev tem",Negativo
"As perversa se ouriça, e os inimigo treme","pervers ouriç , inimig trem",Negativo
E a neblina cobre a estrada de itapecirica,neblin cobr estr itapecir,Negativo
"Sai, sai, sai, sai, sai Deus é mais, vai morrer pra lá zica","sai , sai , sai , sai , sai deu , vai morr pra lá zic",Negativo
(Eu quero ver você cantar),( quer ver cant ),Neutro
"Não adianta querer, tem que ser, tem que pá′","adiant quer , , pá′",Neutro
O mundo é diferente da ponte pra cá,mund difer pont pra cá,Neutro
"Não adianta querer ser, tem que ter pra trocar","adiant quer , ter pra troc",Neutro
O mundo é diferente da ponte pra cá,mund difer pont pra cá,Neutro
"Tem que ser, tem que pá'",", pá '",Neutro
O mundo é diferente da ponte pra cá,mund difer pont pra cá,Neutro
"Não adianta querer ser, tem que ter pra trocar","adiant quer , ter pra troc",Neutro
"Outra vez nós aqui, vai vendo","outr vez aqu , vai vend",Neutro
Lavando o ódio embaixo do sereno,lav ódi embaix seren,Negativo
"Cada um no seu castelo, cada um na sua função","cad castel , cad funç",Neutro
(Tudo junto) cada qual na sua solidão,( tud junt ) cad solid,Neutro
"Hey, mulher é mato, a mary jane impera","hey , mulh mat , mary jan imp",Negativo
Dilui a rádio e solta na atmosfera,dilu rádi solt atmosf,Negativo
Faz da quebrada o equilíbrio ecológico,faz quebr equilíbri ecológ,Negativo
E distingue o Judas só no psicológico,disting jud psicológ,Neutro
"Ó, filosofia de fumaça, análise","ó , filosof fumaç , anális",Neutro
Cada favelado é um universo em crise,cad favel univers cris,Negativo
"Quem não quer brilhar, quem não? Mostra quem","qu brilh , ? mostr",Neutro
Ninguém quer ser coadjuvante de ninguém,ninguém qu coadjuv ninguém,Neutro
"Quantos caras bom, no auge se afundaram por fama","quant car bom , aug afund fam",Negativo
E tá tirando dez de havaiana?,tá tir dez havai ?,Negativo
E quem não quer chegar de honda preto e banco de couro,qu cheg hond pret banc cour,Neutro
E ter a caminhada escrita em letras de ouro?,ter caminh escrit letr our ?,Neutro
A mulher mais linda sensual e atraente,mulh lind sens atra,Neutro
"A pele cor da noite, lisa e reluzente","pel cor noit , lis reluz",Neutro
"Andar com quem é mais leal, verdadeiro","and leal , verd",Neutro
"Na vida ou na morte, o mais nobre guerreiro","vid mort , nobr guerr",Neutro
O riso da criança mais triste e carente,ris crianç trist carent,Negativo
"Ouro e diamante, relógio e corrente","our diam , relógi corr",Neutro
Ver minha coroa onde eu sempre quis pôr,ver coro ond sempr quil pôr,Neutro
"De turbante, chofer, uma madame nagô","turb , chof , madam nagô",Neutro
"Sofrer pra que mais, se o mundo jaz do maligno?","sofr pra , mund jaz malign ?",Negativo
Morrer como homem e ter um velório digno,morr hom ter velóri dign,Neutro
Eu nunca tive bicicleta ou vídeo-game,nunc biciclet vídeo-gam,Neutro
Agora eu quero o mundo igual cidadão kane,agor quer mund igual cidad kan,Neutro
"Da ponte pra cá, antes de tudo é uma escola","pont pra cá , ant tud escol",Neutro
"Minha meta é dez, nove e meio nem rola","met dez , nov mei rol",Neutro
"Meio ponto a ver, hum, e morre um","mei pont ver , hum , morr",Negativo
"Meio certo não existe, truta, o ditado é comum","mei cert exist , trut , dit comum",Neutro
"Ser humano perfeito, não tem mesmo não","human perfeit ,",Neutro
Procurada viva ou morta a perfeição,procur viv mort perfe,Neutro
"Errare humano est, grego ou troiano?","err human est , greg troi ?",Negativo
"Latim, tanto faz pra mim, fi de baiano","latim , tant faz pra mim , fi baian",Neutro
"Mas se tiver calor, quentão no verão","cal , quent ver",Negativo
′Cê quer da um rolê no capão daquele jeito,′cê qu rol cap daquel jeit,Neutro
"Mas perde a linha fácil, veste a carapuça","perd linh fácil , vest carap",Negativo
Esquece estes defeitos no seu jaco de camurça,esquec defeit jac camurç,Negativo
"Jardim rosana, treze, tremembé","jardim rosan , trez , tremembé",Neutro
"Santa tereza, valo velho e dom José","sant ter , val velh dom josé",Neutro
"Parque chácara, lídia, vaz","parqu chác , líd , vaz",Neutro
"Fundão, muita treta pra vinícius de morais","fund , muit tret pra viníc moral",Negativo
"Cinco horas da manhã, ainda de madrugada o nosso mano","cinc hor manhã , aind madrug man",Neutro
"sabota levou uns tiros de quebrada vieram me ligar, o","sabot lev um tir quebr vier lig ,",Negativo
que aconteceu com a maldade desse mundo o nosso mano,acontec maldad dess mund man,Negativo
morreu ele saiu de casa tava tudo firmao andando de,morr saiu cas tav tud firma and,Negativo
quebrada levou uns tiros de oitao foi lamentavel oque,quebr lev um tir oita lamenta oqu,Negativo
aconteceu espero que o nosso mano sabota esteja com,acontec esper man sabot,Negativo
deus omano era firmeza era sangue bom igual e todo,deu oman firm sang bom igual tod,Neutro
mundo na favela do canao ele era de responsa era de,mund favel cana respons,Neutro
atitude tipo na espraiada que os irmao nunca se ilude,atitud tip esprai irma nunc ilud,Neutro
vou mandando omeu rap sem compromisso e melhor esta,vou mand omeu rap compromiss melhor,Neutro
rimando do que ta correndo risco espero que com meu,rim ta corr risc esper,Negativo
